{
  "schema_version": 1,
  "repository": "coferlandia/coferlandia-skills",
  "documentation": [
    "AGENTS.md",
    "_protocol/PROMPT_SPEC.md",
    "_protocol/PROMPT_QUALITY_STANDARDS.md",
    "skills/meta/coferlandia-ci-adapter/references/profile-contract.md"
  ],
  "working_directory": ".",
  "commands": [
    {
      "id": "install-jsonschema",
      "command": "python -m pip install jsonschema",
      "purpose": "Install the dependency required by prompt and delivery contract validation"
    },
    {
      "id": "profile-check",
      "command": "python skills/meta/coferlandia-ci-adapter/scripts/coferlandia-ci-adapter-cli.py profile check --profile .coferlandia/ci/profile.json --expect-fingerprint 4220cac44505839f0a22ddce91dc511ad3b15f4db94929332c5526f5b65c1e39 --json",
      "purpose": "Validate the repository Qualification profile and its fingerprint"
    },
    {
      "id": "prompt-contracts",
      "command": "python _protocol/scripts/validate_prompt.py validate --root . && python -m unittest discover -s prompts/tests -p \"test_*.py\" && python -m unittest _protocol.delivery.test_contracts",
      "purpose": "Validate changed Chat prompt and shared delivery contracts"
    },
    {
      "id": "version-audit",
      "command": "python _protocol/scripts/bump_version.py --check && python _protocol/scripts/bump_version.py --audit",
      "purpose": "Validate repository and prompt version declarations"
    },
    {
      "id": "release-ready",
      "command": "python .agents/skills/coferlandia-release-maintainer/scripts/coferlandia-release-maintainer-cli.py check --base main --release-ready",
      "purpose": "Validate final-delivery release readiness against the authoritative base"
    }
  ],
  "required_services": [],
  "environment": [],
  "github": {
    "submission": {
      "mode": "existing-pr-events",
      "workflow": ".github/workflows/coferlandia-development-validation.yml"
    },
    "candidate_binding": "pull-request-head",
    "runner_labels": [
      "ubuntu-latest"
    ],
    "shell": "bash",
    "setup": [
      {
        "name": "Set up Python",
        "uses": "actions/setup-python@v7",
        "with": {
          "python-version": "3.13"
        }
      }
    ],
    "gate": {
      "name": "Development Validation / Gate",
      "allowed_conclusions": [
        "success"
      ]
    }
  },
  "fingerprint": "0bdab7871300fd9d2376713411de92c29e754c32fcbf8c8a7a628bea2b1365e5"
}
